<?xml version="1.0" encoding="UTF-8"?>
<xs:schema  xmlns:xs="http://www.w3.org/2001/XMLSchema">
  <xs:element name="mundo">
    <xs:complexType>
      <xs:sequence>
        <xs:element name="pais" maxOccurs="unbounded" minOccurs="0">
          <xs:complexType>
            <xs:sequence>
              <xs:element type="xs:string" name="nombre"/>
              <xs:element type="xs:string" name="capital"/>
              <xs:element  name="continente">
			  <xs:simpleType>
			  <xs:restriction base="xs:string">
			  <xs:pattern value="Asia|America|Europa"></xs:pattern>
			  
			  <!-- <xs:enumeration value="Asia"></xs:enumeration> -->
			   <!-- <xs:enumeration value="America"></xs:enumeration> -->
			    <!-- <xs:enumeration value="Europa"></xs:enumeration> -->
				
			  </xs:restriction>
			  </xs:simpleType>
			  </xs:element>
            </xs:sequence>
          </xs:complexType>
        </xs:element>
      </xs:sequence>
    </xs:complexType>
  </xs:element>
</xs:schema>